{
  "schema_version": "originagent.evolution.challenge_record.v1",
  "challenge_id": "0x319f5d64301e74879cbf784ada6759b966a724b578d30823706e09a6229d1e24",
  "evidence_id": "0x361b495f66880e093aafba25cae772528fcfd6a76dde0777236bf7a3b5a8baf6",
  "module_digest": "0xaaaaaaaaaaaaaaaaaaaaaaaaaaaaaaaaaaaaaaaaaaaaaaaaaaaaaaaaaaaaaaaa",
  "reason_hash": "0xcccccccccccccccccccccccccccccccccccccccccccccccccccccccccccccccc",
  "challenger": "0x6666666666666666666666666666666666666666",
  "created_at": "2026-05-23T00:02:00Z",
  "status": "upheld",
  "reporter": "0x6666666666666666666666666666666666666666",
  "resolution_hash": "0xaaaaaaaaaaaaaaaaaaaaaaaaaaaaaaaaaaaaaaaaaaaaaaaaaaaaaaaaaaaaaaaa"
}
